ID,DATE,TIME,TIME_OF_DAY,NETWORK,HEADLINE,SENTIMENT_LABEL,SENTIMENT_SCORE,EMOTION_SADNESS,EMOTION_FEAR,EMOTION_ANGER,EMOTION_DISGUST,EMOTION_JOY,PUTIN,TRUMP,TRUDEAU
414,2017-07-31,11:00:00,Morning,CBC,"'Dithering' by B.C., Ottawa helped kill Pacific NorthWest LNG, energy CEO says",negative,-0.707839,0.305804,0.28984,0.309055,0.05445,0.157581,0,0,0
415,2017-07-31,11:00:00,Morning,CBC,"Canada's longest-standing First Nations boil water advisory will end in 2018, Liberals say",neutral,0.0,0.26238,0.018706,0.40637,0.503227,0.076425,0,0,0
416,2017-07-31,11:00:00,Morning,CBC,"Lender risk sharing could exacerbate a housing downturn, fed draft report says",negative,-0.878113,0.525597,0.169025,0.167858,0.05449,0.081532,0,0,0
417,2017-07-31,11:00:00,Morning,CBC,"B.C. premier says Canada-U.S. close to deal on softwood, but negotiations intense",neutral,0.0,0.410023,0.136086,0.229116,0.081655,0.126264,0,0,0
418,2017-07-31,11:00:00,Morning,CBC,Federal gov't announces plan to protect caribou after legal action taken,negative,-0.565667,0.226156,0.033177,0.085871,0.25607,0.146879,0,0,0
419,2017-07-31,11:00:00,Morning,CBC,Red Cross to monitor Canada's immigration detention centres,negative,-0.602486,0.052799,0.124244,0.079311,0.074411,0.181073,0,0,0
